{
  "attestation_type": "drift_review_result",
  "schema_version": 1,
  "source_task_type": "drift_review",
  "classification": "acceptable duplication / false positive",
  "cleanup_required": false,
  "reviewer_type": "human",
  "evidence_summary": "The completed Phase 1 drift-review loop found the remaining candidate acceptable: the overlap reflected benign duplication and did not require notes/playbook cleanup."
}
